{"addendum_id":"mfenx-local-v2-20260821-a1-step2-addendum-a1","artifact_count":33,"artifacts":[{"media_type":"text/markdown","path":"release/mfenx-local-v2-20260821-a1-step2-addendum-a1/README.md","role":"addendum_readme","sha256":"286e832b0547b2d32aedcf812d35d0ebfff8cc6f4fb1083bc348a30aaae1f81e","size_bytes":4136},{"media_type":"text/markdown","path":"release/mfenx-local-v2-20260821-a1-step2-addendum-a1/CLAIM_LEDGER.md","role":"addendum_claim_ledger","sha256":"4748608166803d16304dc94879bd06209a753b34f01fecf8ca59d227609def7b","size_bytes":5653},{"media_type":"text/markdown","path":"release/mfenx-local-v2-20260821-a1-step2-addendum-a1/SIGNING.md","role":"addendum_signing_doc","sha256":"beea5767b65470c1456ba2eba879cbce3b99328e5fda1f8fdc342673f191bf6b","size_bytes":2408},{"media_type":"text/markdown","path":"release/mfenx-local-v2-20260821-a1-step2-addendum-a1/SIGNING-AUDIT.md","role":"addendum_signing_decision_record","sha256":"d29e661d9d139094b78abc5978f64832fd9c69e42b1c51db3e4f7b5146af446a","size_bytes":3170},{"media_type":"text/markdown","path":"release/mfenx-local-v2-20260821-a1-step2-addendum-a1/SUPPLY_CHAIN_PLAN.md","role":"addendum_supply_chain_plan","sha256":"7fb52c5f1145d05d5f1b0d1491f42bcd3654b92db6106733672c6f4c4bb65e90","size_bytes":4867},{"media_type":"application/schema+json","path":"release/mfenx-local-v2-20260821-a1-step2-addendum-a1/ADDENDUM-MANIFEST.schema.json","role":"addendum_manifest_schema","sha256":"3af4322d053d413dfe7f0a68eeb9ea94689dd9ea6cd7100755945766e099dc39","size_bytes":7100},{"media_type":"application/x-sh","path":"release/mfenx-local-v2-20260821-a1-step2-addendum-a1/generate-addendum-manifest.sh","role":"addendum_manifest_generator","sha256":"3cf2bda7f215af7016384bdd3a72e21adcebc523a0704c64c812598f13916eae","size_bytes":16014},{"media_type":"application/x-sh","path":"release/mfenx-local-v2-20260821-a1-step2-addendum-a1/verify-addendum.sh","role":"addendum_verification_script","sha256":"0cdc1139db99f4620b09ce7dee0c3a0af6b015da7ba939d6bfac0e034e699803","size_bytes":22326},{"media_type":"application/ssh-key","path":"release/mfenx-local-v2-20260821-a1-step2-addendum-a1/release-signing-key.pub","role":"release_public_key","sha256":"0f7c5f5eacc52b9f5c54eb7a5166e7e8e0a5a5b73d9a23f94dc9e2bdad244426","size_bytes":113},{"media_type":"text/plain","path":"release/mfenx-local-v2-20260821-a1-step2-addendum-a1/allowed_signers","role":"signature_verification_policy","sha256":"d776573227d74fde79fb52da6e97b1a7d4c15c7097beecce402d3e2cbf878cfb","size_bytes":161},{"media_type":"application/vnd.cyclonedx+json","path":"release/mfenx-local-v2-20260821-a1-step2-addendum-a1/mfenx-local-v2-step2.sbom.cdx.json","role":"step2_sbom","sha256":"732864847d007449d06b713527f16fc75c18f4a03d4a5e5b9351e877fa8baf44","size_bytes":24769},{"media_type":"application/vnd.in-toto+json","path":"release/mfenx-local-v2-20260821-a1-step2-addendum-a1/mfenx-local-v2-step2.provenance.intoto.json","role":"step2_provenance","sha256":"cca7f3747b5f707db967934e63d6001f07a9e25d7fa5cb8c4b02fa9da5125b9a","size_bytes":9803},{"media_type":"application/json","path":"evidence/mfenx-step2-supply-chain-20260822-a1/generation-record.json","role":"step2_supply_chain_generation_record","sha256":"8c0f6d8c9b6cd4c3e261e7f3fedfd7aee9d933dd4c972c344e0e1406c2e84a34","size_bytes":6403},{"media_type":"text/plain","path":"evidence/mfenx-step2-supply-chain-20260822-a1/SHA256SUMS","role":"step2_supply_chain_evidence_inventory","sha256":"b3ebd35538f1a095fd3ea1d1685a630ae5664ecb1f118103105421b85b7ef195","size_bytes":5496},{"media_type":"application/x-executable","path":"evidence/mfenx-contract-v1-verifier-20260821-a1/bin/mfenx-contract-v1-verifier-build-a","role":"reference_verifier_binary","sha256":"f3714660b9deeef3bd8ecef716c40580c7596c0903f05e89d555ed0d32e9b9fa","size_bytes":998760},{"media_type":"text/plain","path":"evidence/mfenx-contract-v1-verifier-20260821-a1/source/SHA256SUMS","role":"reference_verifier_source_inventory","sha256":"66526aaf501992b896cb42bba066b6a56bc5cc15171581a5e3f91f39b1521e99","size_bytes":545},{"media_type":"application/json","path":"evidence/mfenx-contract-v1-verifier-20260821-a1/build-record.json","role":"reference_verifier_build_record","sha256":"f2333c5f687399a3e58d3df8ea54611057c28824c4a18353afaabd1b908f6627","size_bytes":3014},{"media_type":"application/json","path":"evidence/mfenx-contract-v1-verifier-20260821-a1/audit.json","role":"reference_verifier_audit_report","sha256":"b2b58eab1a3fd13c329acf14eb88861064df52585e9d6af8154b131f6c25c4e2","size_bytes":3033},{"media_type":"application/json","path":"evidence/mfenx-contract-v1-verifier-20260821-a1/reports/a-uninterrupted.report.json","role":"reference_verifier_w0_report","sha256":"f5ea1f460c85d7f9743aca960ae3ef33b51fce92f6f82ff6b87e4cfbd4035f54","size_bytes":1900},{"media_type":"application/zstd","path":"dist/rarecomp_mfenx-local-supercomputer-v2-step2-a2-0.1.0-x86_64.tar.zst","role":"revisioned_distribution_archive","sha256":"470dee9e3578576b8c2b658c09f7c5b87987383b483a354fbc677f4925d81ff3","size_bytes":1366980},{"media_type":"text/plain","path":"dist/rarecomp_mfenx-local-supercomputer-v2-step2-a2-0.1.0-x86_64.tar.zst.sha256","role":"revisioned_distribution_checksum","sha256":"ea8715dfeafcd9fbe791b95ba670aa7da88053b96fcd89e0e24b84a9a2ca0196","size_bytes":134},{"media_type":"application/json","path":"evidence/mfenx-step2-archive-validation-20260822-a1/summary.json","role":"revisioned_distribution_validation","sha256":"ce89b8443eb47b1abb75e1f3a9f1c8154cfef36b57b9d76e5cbbea3bd94d5584","size_bytes":885},{"media_type":"text/plain","path":"evidence/mfenx-step2-archive-validation-20260822-a1/SHA256SUMS","role":"revisioned_distribution_validation_inventory","sha256":"e907a3280e8b41e30dbf5855da071cfb38c97f2f200fcc0216f2599c626db132","size_bytes":2221},{"media_type":"application/json","path":"evidence/mfenx-local-v2-reproducible-build-20260821-a1/record.json","role":"reproducible_build_record","sha256":"49a0174d9e32899362cf9ed049a4a5ba4298d9b8aaf6a76e40b5bb9a4f304614","size_bytes":11964},{"media_type":"text/plain","path":"evidence/mfenx-local-v2-reproducible-build-20260821-a1/SHA256SUMS","role":"reproducible_build_inventory","sha256":"96db43766874be110f74f85572216924dd9f17c0dd406c904cc1181f074c1564","size_bytes":12976},{"media_type":"text/plain","path":"evidence/mfenx-software-supercomputer-20260820-a1/SHA256SUMS","role":"cross_release_v1_evidence_inventory","sha256":"3a08e8a61b6eb0a9cec94959fa5b666ff1441de6c310b07f388e9ce57a80296d","size_bytes":136817},{"media_type":"application/json","path":"evidence/mfenx-software-supercomputer-20260820-a1/acceptance.json","role":"cross_release_v1_acceptance_record","sha256":"b4fb33fffa4362c6a7d9a9af963e1b1af4e5a32634d6ac5916a43b87868814be","size_bytes":11458},{"media_type":"application/json","path":"evidence/mfenx-software-supercomputer-20260820-a1/provenance/memory-summary.json","role":"cross_release_v1_wall_timing","sha256":"6a32e31aa1f8be2eec04e3eb9d43bd7b34a26da300505f79d49b4d994e6ae1c2","size_bytes":6935},{"media_type":"application/json","path":"evidence/mfenx-software-supercomputer-v2-20260821-a1/provenance/memory-summary.json","role":"cross_release_v2_wall_timing","sha256":"a5b7da9a4b619df04736e2574e5a5e529f920770cfda6aee229aa42b5538b4c9","size_bytes":6907},{"media_type":"text/x-python","path":"packaging/mfenx-local-scaling-harness.py","role":"scaling_plan_source","sha256":"f499d2a9ff581dbbadad65e2593f878f8616ab9c1014c90db8e305b3eebcea75","size_bytes":47543},{"media_type":"text/x-python","path":"packaging/mfenx-local-adversarial-sweep.py","role":"adversarial_plan_source","sha256":"1454272ffb660f3dbf9c4d56700525c85e687cd6dc03293dfa3750cea99284c4","size_bytes":36339},{"media_type":"text/markdown","path":"packaging/STEP2_HARNESSES.md","role":"step2_harness_scope_doc","sha256":"212e9d22503174dd36febdebbb68b495c11ea9a7fb20c6f24b0bc7317642722b","size_bytes":10360},{"media_type":"application/json","path":"dist/validation-logs/step2-source-harness-tests-20260821.json","role":"source_harness_test_record","sha256":"d3220ca267d1b9aa004d7481df1416c120a264c2f79b114fd3a54261c412f33d","size_bytes":1436}],"base_release":{"acceptance_record":{"path":"evidence/mfenx-software-supercomputer-v2-20260821-a1/acceptance.json","sha256":"4f101f8ec4b592b39b4024f198dd9f80cef79d2612556acf377191bee6270ebc","size_bytes":16691},"accepted_executor":{"path":"evidence/mfenx-software-supercomputer-v2-20260821-a1/bin/mfenx-local","sha256":"a1043e568704163b9dedf536c5feb60b0b7fd23097a2a8f0504d55d7ddcb1e3c","size_bytes":2021624},"accepted_output_root":{"algorithm":"blake3","digest":"4691a345a8818af410da311bc4d79131dcd093ff47384e71d4832ca08fed638c","source_path":"evidence/mfenx-software-supercomputer-v2-20260821-a1/acceptance.json"},"manifest":{"path":"release/mfenx-local-v2-20260821-a1/RELEASE-MANIFEST.canonical.json","sha256":"bf854ef7144f11358725aaf8021a91f12fede517ac8110fc44bc08a50950b071","size_bytes":7034},"release_id":"mfenx-local-v2-20260821-a1","sealed_evidence_inventory":{"path":"evidence/mfenx-software-supercomputer-v2-20260821-a1/SHA256SUMS","sha256":"71033d917be233ea260417a1f7521c8098f27715475ad0ddf8318a5ecf2fd966","size_bytes":137783},"signature":{"path":"release/mfenx-local-v2-20260821-a1/RELEASE-MANIFEST.canonical.json.sig","sha256":"2b26d302e978566c95709ac3c4cf93cc10f29ac5d9a02e97470283460efbf1db","size_bytes":306}},"claims":[{"claim_id":"S2-CL-001","evidence_roles":["reference_verifier_binary","reference_verifier_source_inventory","reference_verifier_build_record","reference_verifier_audit_report"],"metrics":{},"qualification":"The verifier is maintained in the same repository, follows the same contract specification, uses the same Rust toolchain, and is not independently authored or separately governed.","statement":"A separately invocable contract-v1 reference verifier owns its wire types, canonicalization checks, digest derivations, bounded storage reader, resource formulas, result validation, and arithmetic replay and neither imports nor executes the MFENX ex